{
  "$schema": "./versions.schema.json",
  "schema": 1,
  "updatedAt": "2026-10-27T11:30:00Z",
  "components": {
    "gateway": {
      "repo": "laozhong86/OmniMux",
      "visibility": "private",
      "branch": "main",
      "commit": "faca8ddaddbccb9f4e09de23d056015f353c84cc",
      "version": "v1.0.0-rc.44+omnimux.20261027.gfaca8ddaddbc",
      "license": "AGPL-3.0",
      "note": "Fork of QuantumNous/new-api. Source availability obligations apply."
    },
    "desktop": {
      "repo": "laozhong86/omnimux-desktop-fork",
      "visibility": "private",
      "branch": "omnimux",
      "commit": "3e659aed56dc9a9dae24f782c7a917e9d7339b3c",
      "version": "2.0.18",
      "license": "MIT",
      "note": "Default branch is omnimux, not main."
    },
    "plugins": {
      "repo": "omnimux-ai/omnimux-dsh",
      "visibility": "public",
      "branch": "main",
      "commit": "2c225b7b94c6acd57edded7585b1a6051e4e9eba",
      "license": "OmniMux Sustainable Source License 1.0",
      "packages": {
        "omnimux": "0.1.3",
        "omnimux-accounts": "0.1.2",
        "omnimux-analytics": "0.2.1",
        "omnimux-assets": "0.2.1",
        "omnimux-clip": "0.1.1",
        "omnimux-forms": "0.1.1",
        "omnimux-inspiration": "0.1.1",
        "omnimux-market": "0.2.13-omni.1",
        "omnimux-products": "0.1.1",
        "omnimux-publish": "0.1.1",
        "omnimux-video": "0.1.1",
        "omnimux-workflow": "1.0.0-rc.2"
      },
      "note": "Package versions are the ones locked by the desktop yarn.lock, not the plugin repo package.json versions."
    }
  },
  "compatibility": {
    "minGateway": "v1.0.0-rc.44",
    "minDesktop": "2.0.18"
  }
}
